{
  "schemaVersion": 2,
  "id": "ruin",
  "name": "Ruin",
  "visualProfile": "dimetric-30-v1",
  "pixelsPerCell": 128,
  "filtering": "nearest",
  "tiles": [
    {"id": "grass", "name": "Grass", "kind": "ground", "sourceSizePx": [128, 128], "coverageCells": [1, 1], "files": ["tiles/grass.png"], "transitionPolicy": "rigid"},
    {"id": "dirt", "name": "Dirt", "kind": "ground", "sourceSizePx": [128, 128], "coverageCells": [1, 1], "files": ["tiles/dirt.png"], "transitionPolicy": "rigid"},
    {"id": "cobble", "name": "Cobble", "kind": "ground", "sourceSizePx": [128, 128], "coverageCells": [1, 1], "files": ["tiles/cobble.png"], "transitionPolicy": "rigid"},
    {"id": "floor", "name": "Ruin floor", "kind": "ground", "sourceSizePx": [128, 128], "coverageCells": [1, 1], "files": ["tiles/floor.png"], "transitionPolicy": "rigid"},
    {"id": "cliff", "name": "Cliff", "kind": "side", "sourceSizePx": [128, 128], "coverageCells": [1, 1], "files": ["tiles/cliff.png"], "transitionPolicy": "none"},
    {"id": "leaves", "name": "Leaves", "kind": "overlay", "sourceSizePx": [128, 128], "coverageCells": [1, 1], "files": ["tiles/leaves.png"], "transitionPolicy": "none"}
  ],
  "objects": [
    {
      "id": "oak",
      "name": "Oak",
      "kind": "static",
      "placement": "cell",
      "footprintCells": [2, 2],
      "originCells": [1, 1],
      "pixelsPerWorldUnit": 128,
      "renderLayers": [{"kind": "upright", "file": "objects/oak.png", "sizePx": [64, 96], "pivotPx": [32, 90]}],
      "blocksMovement": true,
      "blocksVision": true,
      "occludesVisually": true,
      "collisionPolygon": [[-0.2, -0.2], [0.2, -0.2], [0.2, 0.2], [-0.2, 0.2]],
      "visionVolumes": [{"polygon": [[-0.2, -0.2], [0.2, -0.2], [0.2, 0.2], [-0.2, 0.2]], "baseHeight": 0, "height": 3}]
    },
    {
      "id": "barrel",
      "name": "Barrel",
      "kind": "static",
      "placement": "cell",
      "footprintCells": [1, 1],
      "pixelsPerWorldUnit": 128,
      "renderLayers": [{"kind": "upright", "file": "objects/barrel.png", "sizePx": [32, 48], "pivotPx": [16, 46]}],
      "blocksMovement": true,
      "blocksVision": false,
      "occludesVisually": true
    },
    {
      "id": "table",
      "name": "Table",
      "kind": "static",
      "placement": "cell",
      "footprintCells": [2, 1],
      "pixelsPerWorldUnit": 128,
      "renderLayers": [{"kind": "upright", "file": "objects/table.png", "sizePx": [48, 32], "pivotPx": [24, 30]}],
      "blocksMovement": true,
      "blocksVision": false,
      "occludesVisually": true
    },
    {
      "id": "hedge",
      "name": "Hedge",
      "kind": "static",
      "placement": "cell",
      "footprintCells": [1, 1],
      "pixelsPerWorldUnit": 128,
      "renderLayers": [{"kind": "upright", "file": "objects/hedge.png", "sizePx": [32, 32], "pivotPx": [16, 30]}],
      "blocksMovement": false,
      "blocksVision": true,
      "occludesVisually": true,
      "visionVolumes": [{"polygon": [[-0.4, -0.1], [0.4, -0.1], [0.4, 0.1], [-0.4, 0.1]], "baseHeight": 0, "height": 0.5}]
    },
    {
      "id": "wall",
      "name": "Wall",
      "kind": "wall",
      "placement": "edge",
      "footprintCells": [1, 1],
      "pixelsPerWorldUnit": 128,
      "renderLayers": [
        {"kind": "upright", "file": "objects/wall-h.png", "sizePx": [16, 48], "pivotPx": [8, 46], "axis": "h"},
        {"kind": "upright", "file": "objects/wall-v.png", "sizePx": [16, 48], "pivotPx": [8, 46], "axis": "v"}
      ],
      "blocksMovement": true,
      "blocksVision": true,
      "occludesVisually": true
    },
    {
      "id": "door",
      "name": "Door",
      "kind": "door",
      "placement": "edge",
      "footprintCells": [1, 1],
      "pixelsPerWorldUnit": 128,
      "renderLayers": [
        {"kind": "upright", "file": "objects/door-h-closed.png", "sizePx": [16, 48], "pivotPx": [8, 46], "axis": "h", "state": "closed"},
        {"kind": "upright", "file": "objects/door-h-open.png", "sizePx": [16, 48], "pivotPx": [8, 46], "axis": "h", "state": "open"},
        {"kind": "upright", "file": "objects/door-v-closed.png", "sizePx": [16, 48], "pivotPx": [8, 46], "axis": "v", "state": "closed"},
        {"kind": "upright", "file": "objects/door-v-open.png", "sizePx": [16, 48], "pivotPx": [8, 46], "axis": "v", "state": "open"}
      ],
      "blocksMovement": true,
      "blocksVision": true,
      "occludesVisually": true
    },
    {
      "id": "stair",
      "name": "Stair",
      "kind": "stairs",
      "placement": "connection",
      "footprintCells": [1, 1],
      "pixelsPerWorldUnit": 128,
      "renderLayers": [{"kind": "upright", "file": "objects/stair.png", "sizePx": [32, 48], "pivotPx": [16, 46]}]
    }
  ],
  "cast": [
    {
      "id": "bandit",
      "name": "Bandit",
      "pixelsPerWorldUnit": 128,
      "suggestedFootprintCells": [1, 1],
      "views": {
        "north": {"file": "cast/bandit/north.png", "sizePx": [32, 64], "pivotPx": [16, 60]},
        "east": {"file": "cast/bandit/east.png", "sizePx": [32, 64], "pivotPx": [16, 60]},
        "south": {"file": "cast/bandit/south.png", "sizePx": [32, 64], "pivotPx": [16, 60]},
        "west": {"file": "cast/bandit/west.png", "sizePx": [32, 64], "pivotPx": [16, 60]}
      }
    },
    {
      "id": "brute",
      "name": "Brute",
      "pixelsPerWorldUnit": 128,
      "suggestedFootprintCells": [2, 2],
      "views": {
        "north": {"file": "cast/bandit/north.png", "sizePx": [32, 64], "pivotPx": [16, 60]},
        "east": {"file": "cast/bandit/east.png", "sizePx": [32, 64], "pivotPx": [16, 60]},
        "south": {"file": "cast/bandit/south.png", "sizePx": [32, 64], "pivotPx": [16, 60]},
        "west": {"file": "cast/bandit/west.png", "sizePx": [32, 64], "pivotPx": [16, 60]}
      }
    },
    {
      "id": "scout",
      "name": "Scout",
      "pixelsPerWorldUnit": 128,
      "suggestedFootprintCells": [1, 1],
      "views": {
        "north": {"file": "cast/scout/north.png", "sizePx": [32, 64], "pivotPx": [16, 60]},
        "east": {"file": "cast/scout/east.png", "sizePx": [32, 64], "pivotPx": [16, 60]},
        "south": {"file": "cast/scout/south.png", "sizePx": [32, 64], "pivotPx": [16, 60]},
        "west": {"file": "cast/scout/west.png", "sizePx": [32, 64], "pivotPx": [16, 60]}
      }
    }
  ]
}
